{
  "$schema": "https://json-schema.org/draft/2020-12/schema",
  "title": "Execution site job v1",
  "type": "object",
  "additionalProperties": false,
  "required": [
    "version",
    "executionSiteId",
    "simulationId",
    "logicalAttemptId",
    "requiredCapabilities",
    "runtime",
    "input",
    "output",
    "resources"
  ],
  "properties": {
    "version": {
      "const": "execution-site-job.v1"
    },
    "executionSiteId": {
      "type": "string",
      "minLength": 1
    },
    "simulationId": {
      "type": "string",
      "minLength": 1
    },
    "logicalAttemptId": {
      "type": "string",
      "minLength": 1
    },
    "requiredCapabilities": {
      "type": "array",
      "uniqueItems": true,
      "items": {
        "type": "string"
      },
      "minItems": 1
    },
    "runtime": {
      "type": "object",
      "additionalProperties": false,
      "required": [
        "digest"
      ],
      "properties": {
        "digest": {
          "type": "string",
          "pattern": "^sha256:[a-f0-9]{64}$"
        }
      }
    },
    "input": {
      "type": "object",
      "additionalProperties": false,
      "required": [
        "uri",
        "digest"
      ],
      "properties": {
        "uri": {
          "type": "string",
          "format": "uri"
        },
        "digest": {
          "type": "string",
          "pattern": "^sha256:[a-f0-9]{64}$"
        }
      }
    },
    "output": {
      "type": "object",
      "additionalProperties": false,
      "required": [
        "uri"
      ],
      "properties": {
        "uri": {
          "type": "string",
          "format": "uri"
        }
      }
    },
    "resources": {
      "oneOf": [
        {
          "type": "object",
          "additionalProperties": false,
          "required": [
            "nodes",
            "mpiRanks",
            "wallTimeSeconds"
          ],
          "properties": {
            "cpu": {
              "type": "integer",
              "minimum": 1,
              "maximum": 128
            },
            "memoryMiB": {
              "type": "integer",
              "minimum": 1,
              "maximum": 262144
            },
            "nodes": {
              "type": "integer",
              "minimum": 1,
              "maximum": 2
            },
            "mpiRanks": {
              "type": "integer",
              "minimum": 1,
              "maximum": 8
            },
            "wallTimeSeconds": {
              "type": "integer",
              "minimum": 60,
              "maximum": 7200
            },
            "allowCpuSharing": {
              "type": "boolean",
              "default": false
            },
            "plannerMemoryMiB": {
              "type": "integer",
              "minimum": 1,
              "maximum": 124518
            },
            "mode": {
              "const": "independent-frequency.v1"
            },
            "gpusPerNode": {
              "type": "integer",
              "minimum": 0,
              "maximum": 2,
              "default": 0
            }
          },
          "allOf": [
            {
              "if": {
                "properties": {
                  "nodes": {
                    "const": 1
                  },
                  "gpusPerNode": {
                    "enum": [
                      0,
                      1
                    ]
                  }
                }
              },
              "then": {
                "properties": {
                  "mpiRanks": {
                    "const": 1
                  }
                }
              },
              "else": {
                "properties": {
                  "mpiRanks": {
                    "enum": [
                      2,
                      4,
                      6,
                      8
                    ]
                  }
                }
              }
            },
            {
              "if": {
                "required": [
                  "allowCpuSharing"
                ],
                "properties": {
                  "allowCpuSharing": {
                    "const": true
                  }
                }
              },
              "then": {
                "properties": {
                  "nodes": {
                    "const": 1
                  },
                  "mpiRanks": {
                    "const": 1
                  }
                }
              }
            },
            {
              "if": {
                "required": [
                  "gpusPerNode"
                ],
                "properties": {
                  "gpusPerNode": {
                    "const": 1
                  }
                }
              },
              "then": {
                "properties": {
                  "nodes": {
                    "const": 1
                  },
                  "mpiRanks": {
                    "const": 1
                  },
                  "cpu": {
                    "enum": [
                      32,
                      64
                    ]
                  },
                  "allowCpuSharing": {
                    "const": false
                  },
                  "memoryMiB": {
                    "maximum": 124518
                  }
                }
              }
            },
            {
              "if": {
                "required": [
                  "gpusPerNode"
                ],
                "properties": {
                  "gpusPerNode": {
                    "const": 2
                  }
                }
              },
              "then": {
                "properties": {
                  "nodes": {
                    "const": 1
                  },
                  "mpiRanks": {
                    "const": 2
                  },
                  "cpu": {
                    "const": 64
                  },
                  "allowCpuSharing": {
                    "const": false
                  },
                  "memoryMiB": {
                    "maximum": 124518
                  }
                }
              }
            }
          ]
        },
        {
          "type": "object",
          "additionalProperties": false,
          "required": [
            "mode",
            "nodes",
            "mpiRanks",
            "wallTimeSeconds",
            "pool"
          ],
          "properties": {
            "nodes": {
              "type": "integer",
              "minimum": 1,
              "maximum": 2
            },
            "mpiRanks": {
              "type": "integer",
              "minimum": 1,
              "maximum": 8
            },
            "wallTimeSeconds": {
              "type": "integer",
              "minimum": 60,
              "maximum": 7200
            },
            "mode": {
              "const": "adaptive-allocation.v1"
            },
            "pool": {
              "type": "object",
              "additionalProperties": false,
              "required": [
                "threadsPerRank",
                "memoryMiBPerNode",
                "partition"
              ],
              "properties": {
                "threadsPerRank": {
                  "type": "integer",
                  "minimum": 1,
                  "maximum": 64
                },
                "memoryMiBPerNode": {
                  "type": "integer",
                  "minimum": 1,
                  "maximum": 124518
                },
                "partition": {
                  "type": "string",
                  "pattern": "^[A-Za-z0-9][A-Za-z0-9_.-]{0,63}$"
                }
              }
            }
          }
        }
      ]
    },
    "scheduler": {
      "type": "object",
      "additionalProperties": false,
      "required": [
        "version",
        "digest"
      ],
      "properties": {
        "version": {
          "const": "adaptive-scheduler.v1"
        },
        "digest": {
          "type": "string",
          "pattern": "^sha256:[a-f0-9]{64}$"
        }
      }
    },
    "placement": {
      "type": "object",
      "additionalProperties": false,
      "properties": {
        "partition": {
          "type": "string",
          "pattern": "^[A-Za-z0-9][A-Za-z0-9_.-]{0,63}$"
        },
        "schedulerPartition": {
          "type": "string",
          "pattern": "^[A-Za-z0-9][A-Za-z0-9_.-]{0,63}$"
        },
        "catalogRevision": {
          "type": "string",
          "pattern": "^[A-Za-z0-9._-]{1,100}$"
        },
        "allowUnverifiedCompute": {
          "type": "boolean"
        },
        "networkFabric": {
          "type": "string",
          "minLength": 1
        },
        "compatibilityFindings": {
          "type": "array",
          "items": {
            "type": "string"
          }
        },
        "gpu": {
          "oneOf": [
            {
              "type": "object",
              "additionalProperties": false,
              "required": [
                "version",
                "model",
                "count",
                "memoryMiB",
                "nativeBundleDigest"
              ],
              "properties": {
                "version": {
                  "const": "cuda-single-gpu.v1"
                },
                "model": {
                  "const": "NVIDIA T4g"
                },
                "count": {
                  "const": 1
                },
                "memoryMiB": {
                  "const": 16384
                },
                "nativeBundleDigest": {
                  "type": "string",
                  "pattern": "^sha256:[a-f0-9]{64}$"
                }
              }
            },
            {
              "type": "object",
              "additionalProperties": false,
              "required": [
                "version",
                "model",
                "count",
                "memoryMiB",
                "nativeBundleDigest",
                "allocatedCount"
              ],
              "properties": {
                "version": {
                  "const": "cuda-gpu.v2"
                },
                "model": {
                  "const": "NVIDIA T4g"
                },
                "count": {
                  "const": 2
                },
                "memoryMiB": {
                  "const": 16384
                },
                "nativeBundleDigest": {
                  "type": "string",
                  "pattern": "^sha256:[a-f0-9]{64}$"
                },
                "allocatedCount": {
                  "enum": [
                    1,
                    2
                  ]
                }
              }
            }
          ]
        }
      },
      "required": [
        "partition",
        "schedulerPartition",
        "catalogRevision",
        "allowUnverifiedCompute",
        "networkFabric",
        "compatibilityFindings"
      ]
    }
  },
  "allOf": [
    {
      "if": {
        "properties": {
          "resources": {
            "required": [
              "mode"
            ],
            "properties": {
              "mode": {
                "const": "adaptive-allocation.v1"
              }
            }
          }
        }
      },
      "then": {
        "required": [
          "scheduler"
        ]
      },
      "else": {
        "not": {
          "required": [
            "scheduler"
          ]
        }
      }
    },
    {
      "if": {
        "required": [
          "resources"
        ],
        "properties": {
          "resources": {
            "required": [
              "gpusPerNode"
            ],
            "properties": {
              "gpusPerNode": {
                "enum": [
                  1,
                  2
                ]
              }
            }
          }
        }
      },
      "then": {
        "required": [
          "placement"
        ],
        "properties": {
          "placement": {
            "required": [
              "gpu"
            ]
          }
        }
      }
    },
    {
      "if": {
        "required": [
          "placement"
        ],
        "properties": {
          "placement": {
            "required": [
              "gpu"
            ]
          }
        }
      },
      "then": {
        "properties": {
          "resources": {
            "required": [
              "gpusPerNode"
            ],
            "properties": {
              "gpusPerNode": {
                "enum": [
                  1,
                  2
                ]
              }
            }
          }
        }
      }
    },
    {
      "if": {
        "required": [
          "placement"
        ],
        "properties": {
          "placement": {
            "required": [
              "gpu"
            ],
            "properties": {
              "gpu": {
                "required": [
                  "version"
                ],
                "properties": {
                  "version": {
                    "const": "cuda-single-gpu.v1"
                  }
                }
              }
            }
          }
        }
      },
      "then": {
        "properties": {
          "requiredCapabilities": {
            "contains": {
              "const": "cuda-single-gpu.v1"
            }
          },
          "resources": {
            "properties": {
              "cpu": {
                "const": 32
              },
              "memoryMiB": {
                "maximum": 62259
              },
              "gpusPerNode": {
                "maximum": 1
              }
            }
          }
        }
      }
    },
    {
      "if": {
        "required": [
          "placement"
        ],
        "properties": {
          "placement": {
            "required": [
              "gpu"
            ],
            "properties": {
              "gpu": {
                "required": [
                  "version"
                ],
                "properties": {
                  "version": {
                    "const": "cuda-gpu.v2"
                  }
                }
              }
            }
          }
        }
      },
      "then": {
        "properties": {
          "requiredCapabilities": {
            "contains": {
              "const": "cuda-gpu.v2"
            }
          },
          "resources": {
            "properties": {
              "cpu": {
                "const": 64
              },
              "memoryMiB": {
                "maximum": 124518
              },
              "gpusPerNode": {
                "maximum": 2
              }
            }
          }
        }
      }
    },
    {
      "if": {
        "required": [
          "placement",
          "resources"
        ],
        "properties": {
          "placement": {
            "required": [
              "gpu"
            ],
            "properties": {
              "gpu": {
                "required": [
                  "version"
                ],
                "properties": {
                  "version": {
                    "const": "cuda-gpu.v2"
                  }
                }
              }
            }
          },
          "resources": {
            "required": [
              "gpusPerNode"
            ],
            "properties": {
              "gpusPerNode": {
                "const": 1
              }
            }
          }
        }
      },
      "then": {
        "properties": {
          "placement": {
            "properties": {
              "gpu": {
                "properties": {
                  "allocatedCount": {
                    "const": 1
                  }
                }
              }
            }
          }
        }
      }
    },
    {
      "if": {
        "required": [
          "placement",
          "resources"
        ],
        "properties": {
          "placement": {
            "required": [
              "gpu"
            ],
            "properties": {
              "gpu": {
                "required": [
                  "version"
                ],
                "properties": {
                  "version": {
                    "const": "cuda-gpu.v2"
                  }
                }
              }
            }
          },
          "resources": {
            "required": [
              "gpusPerNode"
            ],
            "properties": {
              "gpusPerNode": {
                "const": 2
              }
            }
          }
        }
      },
      "then": {
        "properties": {
          "placement": {
            "properties": {
              "gpu": {
                "properties": {
                  "allocatedCount": {
                    "const": 2
                  }
                }
              }
            }
          }
        }
      }
    }
  ]
}
